{"command":"session.status","generated_at":"<generated-at>","request_id":"<request-id>","result":{"allowed_manual_rework_targets":[],"allowed_option_ids":[],"blocker_window":[],"blockers_truncated":false,"counters":[{"attempt_count":1,"graph_node_id":"work","rework_traversal_count":0}],"current":{"attempt":{"attempt_id":"<id-1>","attempt_number":1},"blockers_total":0,"missing_required_item_count":1,"node":{"graph_node_id":"work","node_definition_id":"work","node_type":"action"},"readiness":{"can_advance":false,"goal_ready":true,"items_satisfied":false,"unblocked":true}},"goal_defined":false,"goal_tracking":false,"item_values":[{"item_id":"note","value":"A recorded note.","value_truncated":false}],"items":[{"item_id":"confirm","required":true,"revision":0,"satisfied":false,"type":"confirm"},{"item_id":"note","required":false,"revision":1,"satisfied":true,"type":"text"},{"item_id":"pick","required":false,"revision":0,"satisfied":false,"type":"choice"},{"item_id":"count","required":false,"revision":0,"satisfied":false,"type":"integer"}],"items_total":1,"items_truncated":false,"missing_required_item_ids":["confirm"],"procedure":{"digest":"sha256:7f633580fbfcfee0e5981f7ba7c9b90102037ee821ea616b518368444b4d6dfb","id":"guide006-work","schema":"podway.procedure/v2","version":"1"},"purpose":"Exercise generation-1 observation states.","references":[],"schema":"podway.status-result/v5","session":{"id":"<id-2>","lifecycle":"running","revision":2},"terminal":true,"tier":"standard","trace_length":1},"schema":"podway.output/v4","warnings":[],"workspace":{"latest_workspace_sequence":4,"root":"<worktree-root>","uuid":"<id-3>"}}
