{"command":"session.observe","generated_at":"2023-11-14T22:13:20.001Z","request_id":"00000000-0000-4000-8000-000000000616","result":{"active_items":[],"active_items_total":0,"active_items_truncated":false,"guidance":{"allowed_actions":["session.begin","session.reset","session.start_replace"],"goal_defined":false,"goal_tracking":false,"procedure_digest":"sha256:7f633580fbfcfee0e5981f7ba7c9b90102037ee821ea616b518368444b4d6dfb","procedure_schema":"podway.procedure/v2","revision":0,"schema":"podway.prepared-next-result/v3","session_id":"00000000-0000-4000-8000-000000000610","session_state":"prepared","suggestions":[{"argv":["podway","begin"],"command":"session.begin"},{"argv":["podway","reset"],"command":"session.reset"},{"argv":["podway","start","--on-existing","delete"],"command":"session.start_replace"}],"trace_length":0},"mutation_templates":[{"argv":["podway","begin"],"authority":"optimistic_concurrency_only","command":"session.begin","idempotency_key_required":true,"preconditions":{"session_id":"00000000-0000-4000-8000-000000000610","session_revision":0,"workspace_uuid":"00000000-0000-4000-8000-000000000001"},"requires_explicit_authorization":false},{"argv":["podway","reset"],"authority":"optimistic_concurrency_only","command":"session.reset","idempotency_key_required":true,"preconditions":{"session_id":"00000000-0000-4000-8000-000000000610","session_revision":0,"workspace_uuid":"00000000-0000-4000-8000-000000000001"},"requires_explicit_authorization":false},{"argv":["podway","start","--on-existing","delete"],"authority":"optimistic_concurrency_only","command":"session.start_replace","idempotency_key_required":true,"preconditions":{"session_id":"00000000-0000-4000-8000-000000000610","session_revision":0,"workspace_uuid":"00000000-0000-4000-8000-000000000001"},"requires_explicit_authorization":false}],"mutation_templates_total":3,"mutation_templates_truncated":false,"schema":"podway.observation-result/v5","status":{"counters":[],"current":null,"goal_defined":false,"goal_tracking":false,"items":[],"items_total":0,"items_truncated":false,"procedure":{"digest":"sha256:7f633580fbfcfee0e5981f7ba7c9b90102037ee821ea616b518368444b4d6dfb","id":"guide006-work","schema":"podway.procedure/v2","version":"1"},"session":{"id":"00000000-0000-4000-8000-000000000610","lifecycle":"prepared","revision":0},"trace_length":0}},"schema":"podway.output/v4","warnings":[],"workspace":{"latest_workspace_sequence":2,"root":"<worktree-root>","uuid":"00000000-0000-4000-8000-000000000001"}}
