{"command":"session.observe","generated_at":"2023-11-14T22:13:20.001Z","request_id":"00000000-0000-4000-8000-000000000616","result":{"active_items":[],"active_items_total":0,"active_items_truncated":false,"guidance":null,"mutation_templates":[{"argv":["podway","disposition"],"authority":"optimistic_concurrency_only","command":"session.terminal_disposition","idempotency_key_required":true,"preconditions":{"session_id":"00000000-0000-4000-8000-000000000610","session_revision":3,"workspace_uuid":"00000000-0000-4000-8000-000000000001"},"requires_explicit_authorization":false}],"mutation_templates_total":1,"mutation_templates_truncated":false,"schema":"podway.observation-result/v5","status":{"counters":[{"attempt_count":1,"graph_node_id":"work","rework_traversal_count":0}],"current":null,"goal_defined":false,"goal_tracking":false,"items":[],"items_total":0,"items_truncated":false,"procedure":{"digest":"sha256:7f633580fbfcfee0e5981f7ba7c9b90102037ee821ea616b518368444b4d6dfb","id":"guide006-work","schema":"podway.procedure/v2","version":"1"},"session":{"id":"00000000-0000-4000-8000-000000000610","lifecycle":"completed","revision":3},"trace_length":1}},"schema":"podway.output/v4","warnings":[],"workspace":{"latest_workspace_sequence":5,"root":"<worktree-root>","uuid":"00000000-0000-4000-8000-000000000001"}}
