{"command":"session.observe","generated_at":"2023-11-14T22:13:20.001Z","request_id":"00000000-0000-4000-8000-000000000616","result":{"active_items":[{"constraints":{"choices_total":0,"choices_truncated":false},"item_id":"confirm","prompt":"Confirm.","required":true,"required_now":true,"revision":0,"satisfied":false,"type":"confirm","value":null,"value_truncated":false},{"constraints":{"choices_total":0,"choices_truncated":false,"max_length":100,"min_length":0,"multiline":true},"item_id":"note","prompt":"Record a note.","required":false,"required_now":false,"revision":1,"satisfied":true,"type":"text","value":"A recorded note.","value_truncated":false},{"constraints":{"choices":["yes","no"],"choices_total":2,"choices_truncated":false},"item_id":"pick","prompt":"Pick.","required":false,"required_now":false,"revision":0,"satisfied":false,"type":"choice","value":null,"value_truncated":false},{"constraints":{"choices_total":0,"choices_truncated":false,"maximum":9,"minimum":0},"item_id":"count","prompt":"Count.","required":false,"required_now":false,"revision":0,"satisfied":false,"type":"integer","value":null,"value_truncated":false}],"active_items_total":4,"active_items_truncated":false,"guidance":{"allowed_actions":["item.check","item.set","item.clear","session.retry","session.block","session.cancel","session.reset"],"allowed_manual_rework_targets":[],"attempt":{"attempt_id":"00000000-0000-4000-8000-000000000611","attempt_number":1},"blockers":[],"blockers_total":0,"blockers_truncated":false,"counters":[{"attempt_count":1,"graph_node_id":"work","rework_traversal_count":0}],"goal_defined":false,"goal_tracking":false,"instructions":[],"intent":"Record work.","missing_required_item_count":1,"missing_required_items":[{"item_id":"confirm","prompt":"Confirm."}],"missing_required_items_truncated":false,"node":{"graph_node_id":"work","node_definition_id":"work","node_type":"action"},"procedure_digest":"sha256:7f633580fbfcfee0e5981f7ba7c9b90102037ee821ea616b518368444b4d6dfb","procedure_schema":"podway.procedure/v2","readback":[],"readback_items_total":0,"readback_items_truncated":false,"readiness":{"can_advance":false,"goal_ready":true,"items_satisfied":false,"unblocked":true},"references":[],"revision":2,"schema":"podway.next-result/v5","suggestions":[{"argv":["podway","check","confirm"],"command":"item.check","item_id":"confirm"},{"argv":["podway","retry","--reason","<reason>"],"command":"session.retry"}],"suggestions_total":2,"suggestions_truncated":false,"terminal":true,"title":"Work","trace_length":1},"mutation_templates":[{"argv":["podway","check","confirm","--if-workspace-uuid","00000000-0000-4000-8000-000000000001","--if-session-id","00000000-0000-4000-8000-000000000610","--if-attempt","00000000-0000-4000-8000-000000000611","--if-item-revision","0","--idempotency-key","<idempotency-key>"],"authority":"optimistic_concurrency_only","command":"item.check","idempotency_key_required":true,"preconditions":{"attempt_id":"00000000-0000-4000-8000-000000000611","item_revision":0,"session_id":"00000000-0000-4000-8000-000000000610","workspace_uuid":"00000000-0000-4000-8000-000000000001"},"requires_explicit_authorization":false},{"argv":["podway","retry","--reason","<reason>","--if-workspace-uuid","00000000-0000-4000-8000-000000000001","--if-session-id","00000000-0000-4000-8000-000000000610","--if-session-revision","2","--if-attempt","00000000-0000-4000-8000-000000000611","--idempotency-key","<idempotency-key>"],"authority":"optimistic_concurrency_only","command":"session.retry","idempotency_key_required":true,"preconditions":{"attempt_id":"00000000-0000-4000-8000-000000000611","session_id":"00000000-0000-4000-8000-000000000610","session_revision":2,"workspace_uuid":"00000000-0000-4000-8000-000000000001"},"requires_explicit_authorization":false},{"argv":["podway","set","note","<text>","--if-workspace-uuid","00000000-0000-4000-8000-000000000001","--if-session-id","00000000-0000-4000-8000-000000000610","--if-attempt","00000000-0000-4000-8000-000000000611","--if-item-revision","1","--idempotency-key","<idempotency-key>"],"authority":"optimistic_concurrency_only","command":"item.set","idempotency_key_required":true,"preconditions":{"attempt_id":"00000000-0000-4000-8000-000000000611","item_revision":1,"session_id":"00000000-0000-4000-8000-000000000610","workspace_uuid":"00000000-0000-4000-8000-000000000001"},"requires_explicit_authorization":false},{"argv":["podway","clear","note","--if-workspace-uuid","00000000-0000-4000-8000-000000000001","--if-session-id","00000000-0000-4000-8000-000000000610","--if-attempt","00000000-0000-4000-8000-000000000611","--if-item-revision","1","--idempotency-key","<idempotency-key>"],"authority":"optimistic_concurrency_only","command":"item.clear","idempotency_key_required":true,"preconditions":{"attempt_id":"00000000-0000-4000-8000-000000000611","item_revision":1,"session_id":"00000000-0000-4000-8000-000000000610","workspace_uuid":"00000000-0000-4000-8000-000000000001"},"requires_explicit_authorization":false},{"argv":["podway","set","pick","<choice>","--if-workspace-uuid","00000000-0000-4000-8000-000000000001","--if-session-id","00000000-0000-4000-8000-000000000610","--if-attempt","00000000-0000-4000-8000-000000000611","--if-item-revision","0","--idempotency-key","<idempotency-key>"],"authority":"optimistic_concurrency_only","command":"item.set","idempotency_key_required":true,"preconditions":{"attempt_id":"00000000-0000-4000-8000-000000000611","item_revision":0,"session_id":"00000000-0000-4000-8000-000000000610","workspace_uuid":"00000000-0000-4000-8000-000000000001"},"requires_explicit_authorization":false},{"argv":["podway","set","count","<integer>","--if-workspace-uuid","00000000-0000-4000-8000-000000000001","--if-session-id","00000000-0000-4000-8000-000000000610","--if-attempt","00000000-0000-4000-8000-000000000611","--if-item-revision","0","--idempotency-key","<idempotency-key>"],"authority":"optimistic_concurrency_only","command":"item.set","idempotency_key_required":true,"preconditions":{"attempt_id":"00000000-0000-4000-8000-000000000611","item_revision":0,"session_id":"00000000-0000-4000-8000-000000000610","workspace_uuid":"00000000-0000-4000-8000-000000000001"},"requires_explicit_authorization":false},{"argv":["podway","block","--reason","<reason>","--if-workspace-uuid","00000000-0000-4000-8000-000000000001","--if-session-id","00000000-0000-4000-8000-000000000610","--if-session-revision","2","--if-attempt","00000000-0000-4000-8000-000000000611","--idempotency-key","<idempotency-key>"],"authority":"optimistic_concurrency_only","command":"session.block","idempotency_key_required":true,"preconditions":{"attempt_id":"00000000-0000-4000-8000-000000000611","session_id":"00000000-0000-4000-8000-000000000610","session_revision":2,"workspace_uuid":"00000000-0000-4000-8000-000000000001"},"requires_explicit_authorization":false},{"argv":["podway","cancel","--reason","<reason>","--if-workspace-uuid","00000000-0000-4000-8000-000000000001","--if-session-id","00000000-0000-4000-8000-000000000610","--if-session-revision","2","--if-attempt","00000000-0000-4000-8000-000000000611","--idempotency-key","<idempotency-key>"],"authority":"optimistic_concurrency_only","command":"session.cancel","idempotency_key_required":true,"preconditions":{"attempt_id":"00000000-0000-4000-8000-000000000611","session_id":"00000000-0000-4000-8000-000000000610","session_revision":2,"workspace_uuid":"00000000-0000-4000-8000-000000000001"},"requires_explicit_authorization":true},{"argv":["podway","reset","--progress-summary","<progress-summary>","--yes","--if-workspace-uuid","00000000-0000-4000-8000-000000000001","--if-session-id","00000000-0000-4000-8000-000000000610","--if-session-revision","2","--idempotency-key","<idempotency-key>"],"authority":"optimistic_concurrency_only","command":"session.reset","idempotency_key_required":true,"preconditions":{"session_id":"00000000-0000-4000-8000-000000000610","session_revision":2,"workspace_uuid":"00000000-0000-4000-8000-000000000001"},"requires_explicit_authorization":true}],"mutation_templates_total":9,"mutation_templates_truncated":false,"schema":"podway.observation-result/v5","status":{"counters":[{"attempt_count":1,"graph_node_id":"work","rework_traversal_count":0}],"current":{"attempt":{"attempt_id":"00000000-0000-4000-8000-000000000611","attempt_number":1},"blockers_total":0,"missing_required_item_count":1,"node":{"graph_node_id":"work","node_definition_id":"work","node_type":"action"},"readiness":{"can_advance":false,"goal_ready":true,"items_satisfied":false,"unblocked":true}},"goal_defined":false,"goal_tracking":false,"items":[{"item_id":"confirm","required":true,"revision":0,"satisfied":false,"type":"confirm"},{"item_id":"note","required":false,"revision":1,"satisfied":true,"type":"text"},{"item_id":"pick","required":false,"revision":0,"satisfied":false,"type":"choice"},{"item_id":"count","required":false,"revision":0,"satisfied":false,"type":"integer"}],"items_total":4,"items_truncated":false,"procedure":{"digest":"sha256:7f633580fbfcfee0e5981f7ba7c9b90102037ee821ea616b518368444b4d6dfb","id":"guide006-work","schema":"podway.procedure/v2","version":"1"},"session":{"id":"00000000-0000-4000-8000-000000000610","lifecycle":"running","revision":2},"trace_length":1}},"schema":"podway.output/v4","warnings":[],"workspace":{"latest_workspace_sequence":4,"root":"<worktree-root>","uuid":"00000000-0000-4000-8000-000000000001"}}
