{"command":"session.next","generated_at":"<generated-at>","request_id":"<request-id>","result":{"allowed_actions":["session.begin","session.reset","session.start_replace"],"goal_defined":false,"goal_tracking":false,"procedure_digest":"sha256:7f633580fbfcfee0e5981f7ba7c9b90102037ee821ea616b518368444b4d6dfb","procedure_schema":"podway.procedure/v2","revision":0,"schema":"podway.prepared-next-result/v3","session_id":"<id-1>","session_state":"prepared","suggestions":[{"argv":["podway","begin"],"command":"session.begin"},{"argv":["podway","reset"],"command":"session.reset"},{"argv":["podway","start","--on-existing","delete"],"command":"session.start_replace"}],"trace_length":0},"schema":"podway.output/v4","warnings":[],"workspace":{"latest_workspace_sequence":2,"root":"<worktree-root>","uuid":"<id-2>"}}
