{"command":"session.next","generated_at":"<generated-at>","request_id":"<request-id>","result":{"allowed_actions":["item.check","item.set","item.clear","session.retry","session.block","session.cancel","session.reset"],"allowed_manual_rework_targets":[],"attempt":{"attempt_id":"<id-1>","attempt_number":1},"blockers":[],"blockers_total":0,"blockers_truncated":false,"counters":[{"attempt_count":1,"graph_node_id":"work","rework_traversal_count":0}],"goal_defined":false,"goal_tracking":false,"instructions":[],"intent":"Record work.","missing_required_item_count":1,"missing_required_items":[{"item_id":"confirm","prompt":"Confirm."}],"missing_required_items_truncated":false,"node":{"graph_node_id":"work","node_definition_id":"work","node_type":"action"},"procedure_digest":"sha256:7f633580fbfcfee0e5981f7ba7c9b90102037ee821ea616b518368444b4d6dfb","procedure_schema":"podway.procedure/v2","readback":[],"readback_items_total":0,"readback_items_truncated":false,"readiness":{"can_advance":false,"goal_ready":true,"items_satisfied":false,"unblocked":true},"references":[],"revision":2,"schema":"podway.next-result/v5","suggestions":[{"argv":["podway","check","confirm"],"command":"item.check","item_id":"confirm"},{"argv":["podway","retry","--reason","<reason>"],"command":"session.retry"}],"suggestions_total":2,"suggestions_truncated":false,"terminal":true,"title":"Work","trace_length":1},"schema":"podway.output/v4","warnings":[],"workspace":{"latest_workspace_sequence":4,"root":"<worktree-root>","uuid":"<id-2>"}}
